Company,Sector,Price,Changes,52-wk low,52-wk high,Volume
HDFC Bank Ltd., Bank - Private ,1444.30,-10.35 (-0.71%),1380.25,1757.50,20864384
Reliance Industries Ltd., Oil Exploration and Production ,2815.25,-80.85 (-2.79%),2180.00,2919.95,7046989
Tata Consultancy Services Ltd., IT Services & Consulting ,3800.55,-0.45 (-0.01%),3070.25,3965.00,1411621
ICICI Bank Ltd., Bank - Private ,1016.90,0.50 (0.05%),796.00,1059.40,16085742
Infosys Ltd., IT Services & Consulting ,1651.45,-5.15 (-0.31%),1185.30,1690.00,4995943
Bharti Airtel Ltd., Telecommunication - Service Provider ,1158.65,-3.50 (-0.30%),735.80,1200.65,3902023
Hindustan Unilever Ltd., Household & Personal Products ,2458.65,14.25 (0.58%),2365.45,2769.65,1793711
ITC Ltd., Diversified ,438.05,-11.75 (-2.61%),329.10,499.70,43514448
State Bank of India, Bank - Public ,626.75,3.80 (0.61%),499.35,660.40,16966577
Housing Development Finance Corporation Ltd., Finance - Housing ,,,2026.55,3021.10,
Larsen & Toubro Ltd., Engineering & Construction ,3633.30,-74.70 (-2.01%),2072.65,3737.90,1454989
Bajaj Finance Ltd., Finance - NBFC ,6817.20,-374.45 (-5.21%),5485.70,8192.00,4153147
HCL Technologies Ltd., IT Services & Consulting ,1559.30,-15.25 (-0.97%),1016.25,1619.60,1939386
Kotak Mahindra Bank Ltd., Bank - Private ,1823.60,0.70 (0.04%),1643.50,2064.40,3829187
Titan Company Ltd., Diamond  &  Jewellery ,3735.75,-130.90 (-3.39%),2269.60,3886.95,852445
Adani Enterprises Ltd., Trading ,3091.10,26.45 (0.86%),1017.45,3199.00,3115506
Sun Pharmaceutical Industries Ltd., Pharmaceuticals & Drugs ,1371.75,-29.10 (-2.08%),922.45,1420.85,1935332
Axis Bank Ltd., Bank - Private ,1054.10,-7.15 (-0.67%),814.30,1151.85,9426983
Maruti Suzuki India Ltd., Automobile - Passenger Cars ,9951.65,-39.75 (-0.40%),8130.00,10932.85,399869
NTPC Ltd., Power Generation/Distribution ,315.45,-9.10 (-2.80%),162.55,325.75,20918448
Tata Motors Ltd., Automobile - LCVS/ HVCS ,858.85,17.85 (2.12%),400.45,885.95,19734613
Oil and Natural Gas Corporation Ltd., Oil Exploration and Production ,249.20,-3.30 (-1.31%),140.10,263.30,51491099
UltraTech Cement Ltd., Cement ,9963.60,-310.45 (-3.02%),6642.55,10526.00,368827
Asian Paints Ltd., Paints ,2954.10,-21.95 (-0.74%),2694.00,3568.00,1273188
Adani Green Energy Ltd., Renewables ,1679.45,-36.05 (-2.10%),439.10,1762.05,992518
Bajaj Finserv Ltd., Finance - Investment ,1590.55,-46.40 (-2.83%),1215.00,1741.00,4851835
Adani Ports and Special Economic Zone Ltd., Transport Infrastructure ,1187.35,-9.30 (-0.78%),395.10,1229.90,4683729
Wipro Ltd., IT Services & Consulting ,472.50,-0.50 (-0.11%),352.00,529.00,5914007
Avenue Supermarts Ltd., Retailing ,3687.30,-62.10 (-1.66%),3292.00,4206.00,263265
Coal India Ltd., Coal ,402.55,-10.25 (-2.48%),207.60,415.80,14159072
Nestle India Ltd., Consumer Food ,2492.05,-6.50 (-0.26%),1788.00,2769.30,668034
Power Grid Corporation of India Ltd., Power Generation/Distribution ,254.10,0.15 (0.06%),157.80,256.95,16031367
Bajaj Auto Ltd., Automobile - 2 & 3 Wheelers ,7566.40,17.60 (0.23%),3625.60,7660.00,266287
Mahindra and Mahindra Ltd., Automobile - Auto & Truck Manufacturers ,1620.35,-19.65 (-1.20%),1123.40,1758.00,2569098
Indian Oil Corporation Ltd., Refineries ,147.70,1.00 (0.68%),75.75,152.20,41378967
JSW Steel Ltd., Iron & Steel ,812.00,0.30 (0.04%),649.05,895.75,1892910
DLF Ltd., Construction - Residential & Commercial Complexes ,786.90,19.55 (2.55%),336.50,815.75,10661351
Tata Steel Ltd., Iron & Steel ,134.70,-0.30 (-0.22%),101.55,141.25,35704185
LTIMindtree Ltd., IT Services & Consulting ,5352.80,-95.55 (-1.75%),4132.20,6442.00,830778
Siemens Ltd., Electric Equipment ,4143.55,-162.00 (-3.76%),2891.40,4335.00,488753
Grasim Industries Ltd., Diversified ,2126.15,21.65 (1.03%),1527.05,2175.00,852171
SBI Life Insurance Company Ltd., Life & Health Insurance ,1399.00,-19.40 (-1.37%),1054.00,1495.35,1464906
Pidilite Industries Ltd., Diversified chemicals ,2567.70,-1.60 (-0.06%),2250.05,2805.00,1167215
Tech Mahindra Ltd., IT Services & Consulting ,1317.85,3.50 (0.27%),981.05,1416.30,2293154
Hindalco Industries Ltd., Iron & Steel ,569.25,1.35 (0.24%),381.00,620.50,7968815
HDFC Life Insurance Company Ltd., Life & Health Insurance ,575.00,-3.55 (-0.61%),457.80,710.60,5895638
Britannia Industries Ltd., Consumer Food ,5091.75,-45.15 (-0.88%),4153.00,5386.05,146422
Godrej Consumer Products Ltd., Household & Personal Products ,1171.80,3.70 (0.32%),891.75,1230.00,2259825
Adani Energy Solutions Ltd., Power Generation/Distribution ,1072.70,-25.35 (-2.31%),631.50,1860.00,1393051
IndusInd Bank Ltd., Bank - Private ,1519.90,-6.90 (-0.45%),990.00,1694.50,1721705
Punjab National Bank, Bank - Public ,109.25,1.75 (1.63%),44.40,110.95,75911884
Ambuja Cements Ltd., Cement ,570.85,-3.25 (-0.57%),315.30,583.95,4572466
Cipla Ltd., Pharmaceuticals & Drugs ,1317.10,-19.75 (-1.48%),852.00,1425.00,1908926
Interglobe Aviation Ltd., Airlines ,2929.00,33.00 (1.14%),1810.65,3132.00,1253067
GAIL India Ltd., Gas Distribution ,172.00,0.25 (0.15%),91.05,177.00,57303068
TATA Consumer Products Ltd., Tea/Coffee ,1122.90,-18.15 (-1.59%),686.60,1190.95,798009
Bharat Petroleum Corporation Ltd., Refineries ,504.20,11.55 (2.34%),314.05,517.85,22135938
Shree Cements Ltd., Cement ,28077.75,-333.80 (-1.17%),21860.00,29250.00,30799
Eicher Motors Ltd., Automobile - LCVS/ HVCS ,3704.75,35.70 (0.97%),2836.00,4200.00,612064
Vedanta Ltd., Metals - Non Ferrous ,266.25,-1.55 (-0.58%),208.00,338.25,6620878
Dr Reddys Laboratories Ltd., Pharmaceuticals & Drugs ,5840.95,-2.75 (-0.05%),4284.95,5989.70,315317
Divis Laboratories Ltd., Pharmaceuticals & Drugs ,3551.70,-18.90 (-0.53%),2730.00,4074.40,1052177
Dabur India Ltd., Household & Personal Products ,535.95,1.70 (0.32%),503.65,597.10,1603876
Bajaj Holdings & Investment Ltd., Finance - NBFC ,8251.65,5.10 (0.06%),5770.00,8568.00,34625
Hero Motocorp Ltd., Automobile - 2 & 3 Wheelers ,4588.35,-5.15 (-0.11%),2246.00,4662.00,709726
Apollo Hospitals Enterprises Ltd., Hospital & Healthcare Services ,6309.80,-19.95 (-0.32%),4123.00,6428.70,304312
Torrent Pharmaceuticals Ltd., Pharmaceuticals & Drugs ,2473.15,35.25 (1.45%),1445.55,2551.80,110028
Havells India Ltd., Electric Equipment ,1295.10,-22.80 (-1.73%),1131.80,1472.00,702512
United Spirits Ltd., Breweries & Distilleries ,1080.40,-13.50 (-1.23%),730.55,1146.00,795246
Samvardhana Motherson International Ltd.," Auto Ancillaries - Auto, Truck & Motorcycle Parts ",114.25,-2.15 (-1.85%),61.80,118.00,10530946
Zydus Lifesciences Ltd., Pharmaceuticals & Drugs ,755.90,7.40 (0.99%),425.70,764.50,1126826
HDFC Asset Management Company  Ltd., Finance - Investment ,3510.40,0.30 (0.01%),1589.50,3560.00,574863
ICICI Lombard General Insurance Company Ltd., Multiline Insurance & Brokers ,1499.70,10.85 (0.73%),1049.05,1520.50,805250
SBI Cards & Payment Services Ltd., Finance Term Lending ,712.55,-3.00 (-0.42%),695.55,933.00,4124185
Yes Bank Ltd., Bank - Private ,23.90,-0.45 (-1.85%),14.40,26.25,219652035
ICICI Prudential Life Insurance Company Ltd., Life & Health Insurance ,495.60,4.00 (0.81%),380.70,615.60,3256246
Marico Ltd., Household & Personal Products ,523.15,6.55 (1.27%),462.70,595.00,1822487
Colgate Palmolive (India) Ltd., Household & Personal Products ,2490.50,-36.05 (-1.43%),1434.60,2552.80,313301
Aurobindo Pharma Ltd., Pharmaceuticals & Drugs ,1156.05,-4.80 (-0.41%),397.20,1177.10,1317033
Bosch Ltd.," Auto Ancillaries - Auto, Truck & Motorcycle Parts ",23875.40,626.60 (2.70%),16545.00,24172.05,37640
Lupin Ltd., Pharmaceuticals & Drugs ,1468.15,-15.15 (-1.02%),628.00,1490.95,532307
Berger Paints India Ltd., Paints ,561.80,1.95 (0.35%),439.29,679.75,592044
Info Edge India Ltd., Misc. Commercial Services ,4892.70,-82.55 (-1.66%),3308.20,5404.40,202501
NMDC Ltd., Iron & Steel ,219.70,-1.25 (-0.57%),103.75,227.30,8836773
Hindustan Petroleum Corporation Ltd., Refineries ,471.70,19.40 (4.29%),211.65,485.30,17261998
INDUS TOWERS Ltd., Telecommunication - Equipment ,229.95,-2.30 (-0.99%),135.80,236.00,13591981
Alkem Laboratories Ltd., Pharmaceuticals & Drugs ,4946.30,-29.05 (-0.58%),2980.00,5315.50,164802
MRF Ltd., Auto Ancillaries - Tyres & Rubber Products ,140619.85,"-3,253.75 (-2.26%)",81380.05,150254.15,13414
Muthoot Finance Ltd., Finance - NBFC ,1389.85,-4.10 (-0.29%),911.25,1537.35,727506
Procter and Gamble Hygiene and Health Care Ltd., Household & Personal Products ,17148.40,-118.55 (-0.69%),13140.10,19250.00,3528
Abbott India Ltd., Pharmaceuticals & Drugs ,25508.65,-59.40 (-0.23%),19900.00,26381.65,13033
United Breweries Ltd., Breweries & Distilleries ,1795.30,-6.40 (-0.36%),1353.50,1908.00,45370
ACC Ltd., Cement ,2513.15,20.25 (0.81%),1592.35,2577.80,957680
UPL Ltd., Pesticides & Agrochemicals ,535.25,-4.40 (-0.82%),528.15,780.00,1912294
Petronet LNG Ltd., Oil Exploration and Production ,267.55,4.60 (1.75%),191.70,284.55,36116964
Bandhan Bank Ltd., Bank - Private ,223.45,0.15 (0.07%),182.15,272.00,5249061
Jubilant Foodworks Ltd., Consumer Food ,510.15,-3.00 (-0.58%),412.10,586.95,2464481
Biocon Ltd., Biotechnology & Medical Research ,260.00,-0.10 (-0.04%),191.55,294.50,2637680
Indraprastha Gas Ltd., Gas Distribution ,425.60,6.50 (1.55%),375.70,515.70,3803274
Piramal Enterprises Ltd., Finance - NBFC ,894.20,10.15 (1.15%),630.45,1139.95,3000091
